<?xml version="1.0"?>
<dataDocument xmlns:xsi="http://www.w3.org/2001/XMLSchema-instance" xsi:schemaLocation="example-7.xsd example-7.xsd">
    <a>
        <b>
            <d>
                <e>FISH</e>
                <f>CHIPS</f>
            </d>
        </b>
        <c>
            <d>
                <e>FISH2</e>
                <f>CHIPS2</f>
            </d>
        </c>
    </a>
</dataDocument>